SKU,Product Name,Product Category,Keywords,Description
S0580301001_BLACK,Black Zip Detail Bomber Jacket,womens jackets,"bomber jacket,womens jackets","Embrace the quintessential spirit of chic urban style with our Black Zip Detail Bomber Jacket. This timeless bomber jacket, a must-have addition to our women's jackets collection, has been reimagined with a modern twist, offering an edgy aura that's hard to resist.

Designed to perfection, this bomber jacket is an extraordinary synthesis of comfort and style. Crafted from top-tier materials, it promises an exquisite softness and a hard-wearing finish that stands up to the rigours of your daily grind. The inky black outer layer adds a degree of sophistication and mystery to your look, making it fitting for a variety of occasions.

A standout feature of this bomber jacket that sets it apart is the intricate zip detail. The strategically placed zippers not only serve as a functional element but also inject a bold and rebellious streak into the overall design. 

This particular bomber jacket from our women's jackets range strikes a seamless balance between versatility and a high-fashion edge."
S0580501012_BITTER CHOCOLATE,Bitter Chocolate Oversized Sweat,womens sweaters,"oversized sweat, womens sweaters","Introducing our Bitter Chocolate Oversized Sweat, a must-have addition to every cold-weather wardrobe. As part of our unique range of womens sweaters, this luxurious garment blends comfort, style, and warmth effortlessly. 

Ensconce yourself in the indulgent warmth of this oversized sweat and witness how it magically transforms your winter attire from bland to stylish. This oversized sweat is cut to a relaxed fit, making it an ideal piece for layering over your favourite shirts and beneath snug coats during those chilly, British winter days.

Rendered in a rich, bitter chocolate hue, this exquisite sweater introduces a touch of understated elegance to your outfits. The oversized design invites a casual bravura into your ensemble while ensuring you stay comfortably chic whether you're at home, at work, or out and about.

Crafted from the softest, high-quality material, this sweater promises to keep you cosy and comfortable without compromising on style."
S0582503010_BLACK,Black Large Glitter Mix Panel Purse,womens purses,"glitter panel purse, womens purses","Introducing the Black Large Glitter Mix Panel Purse, the epitome of charm and style in our womens purses collection. This enchanting accessory is much more than just a ticket to high-end fashion; it's a celebration of elegance with a shiny twist. Featuring a distinctly attractive glitter panel, this purse adds a seductive allure to any outfit.

Our Black Large Glitter Panel Purse is expertly crafted, merging function with high-end style. The generous size provides adequate space for all your essentials, making it an ideal companion whether you’re heading to work, shopping trip, or an evening soiree. The glitter panel on this purse exudes an irresistible appeal that brings sparkle to your everyday outfits or lights up your evening attires.

Made with high-quality materials, this glitter panel purse is a quintessential investment for women who appreciate aesthetic meets practicality. The mix panel pattern contributes to the distinctive charm, assuring that you'll stand out in any crowd."
S0580308016_SAGE,Sage Chevron Longline Puffer Gilet,womens gilets,"puffer gilet, womens gilets","Introducing the Sage Chevron Longline Puffer Gilet, a must-have staple piece in any modern woman's wardrobe. Perfectly fitting into the womens gilets category, this uniquely stylish item is a blend of comfort and fashion.

Constructed with a plush puffer shell, this gilet is the ideal companion for braving the chilly British weather without compromising on style. Colored in an elegant sage tone, the gilet offers a subdued yet fashionable aesthetic that pairs well with practically anything in your wardrobe.

What truly sets this puffer gilet apart is the bespoke chevron longline design. This detailing gives the gilet a refined look, flatters the wearer's silhouette and offers extra coverage against cold weather. This puffer gilet isn't shy of practicality, either. The padded fill provides excellent insulation, whilst a handy hood is meant to offer protection against unexpected rain or wind."
S0581503004_BLACK,Black Bardot Tunic,womens tunics,"bardot tunic, womens tunics","Introduce a dash of elegance to your wardrobe with our intricately designed Black Bardot Tunic. Nestled comfortably in our womens tunics category, this piece promises to offer impeccable style and unparalleled comfort.

Our Black Bardot tunic accentuates the beauty of minimalistic design, perfectly balancing style and comfort. Crafted with loving care, this high-quality tunic differentiates itself with a striking bardot neckline - a detail that's both flattering and trend-setting. 

Made with comfortable, lightweight fabric, our bardot tunic is incredibly versatile. Whether you're attending a daytime event or enjoying a relaxed evening, this piece puts a chic spin on any outfit. It's long enough to be worn on its own for a beach day or paired with your favourite pair of skinny jeans for a breezier, more casual look."
TESTPRODUCT,LIGHT KHAKI CASUAL BELTED BODYCON DRESS,womens dresses,"bodycon dress, womens dresses","Introducing our chic and stylish Light Khaki Casual Belted Bodycon Dress, a wardrobe essential perfect for any woman's collection. This remarkable piece, crafted with the modern woman in mind, is not just a dress, it's a statement of confidence, grace, and elegance.

This womens dress is made from soft, high-quality fabric that gently caresses the skin, providing exceptional comfort all day long. Its unique light khaki colour exudes a sense of understated sophistication and grace, ensuring you stand out in any crowd.

The Light Khaki Casual Belted Bodycon Dress features a flattering bodycon silhouette that beautifully shapes and accentuates your curves for a streamlined look. The chic belt included adds a hint of elegance, cinching your waist to highlight your figure. This bodycon dress's subtle design allows your personality to shine through whilst creating an air of effervescent charm.

Whether you're heading to a casual event or a dinner date, this versatile dress fits perfectly into any setting."
